[
  {
    "id": "barbed_spear",
    "name": "Barbed Spear",
    "type": "weapon",
    "category": "spear",
    "rarity": "common",
    "damage": {
      "base": 12,
      "min": 10,
      "max": 14
    },
    "scaling": {
      "strength": 0.7,
      "agility": 0.3,
      "intelligence": 0.0
    },
    "combatModifiers": {
      "speed": -2,
      "critChance": 0.05,
      "blockPower": 3
    },
    "allowedClasses": ["warrior", "paladin", "archer"],
    "allowedRaces": ["human", "elf", "dwarf", "orc", "halfling", "gnome", "demon"],
    "durability": {
      "enabled": false,
      "max": 0
    },
    "cost": 80,
    "sellValue": 40,
    "description": "A spear with vicious barbs that tear flesh on withdrawal.",
    "tags": ["melee", "piercing", "polearm"]
  },
  {
    "id": "battle_axe",
    "name": "Battle Axe",
    "type": "weapon",
    "category": "axe",
    "rarity": "common",
    "damage": {
      "base": 13,
      "min": 10,
      "max": 16
    },
    "scaling": {
      "strength": 0.9,
      "agility": 0.1,
      "intelligence": 0.0
    },
    "combatModifiers": {
      "speed": -5,
      "critChance": 0.04,
      "blockPower": 4
    },
    "allowedClasses": ["warrior", "paladin"],
    "allowedRaces": ["human", "elf", "dwarf", "orc", "halfling", "gnome", "demon"],
    "durability": {
      "enabled": false,
      "max": 0
    },
    "cost": 100,
    "sellValue": 50,
    "description": "A sturdy, single-bladed axe favored by front-line fighters.",
    "tags": ["melee", "slashing", "heavy"]
  },
  {
    "id": "blackjack_sap",
    "name": "Blackjack (sap)",
    "type": "weapon",
    "category": "bludgeon",
    "rarity": "common",
    "damage": {
      "base": 6,
      "min": 4,
      "max": 8
    },
    "scaling": {
      "strength": 0.4,
      "agility": 0.4,
      "intelligence": 0.0
    },
    "combatModifiers": {
      "speed": 8,
      "critChance": 0.10,
      "blockPower": 0
    },
    "allowedClasses": ["rogue", "assassin", "warrior"],
    "allowedRaces": ["human", "elf", "dwarf", "orc", "halfling", "gnome", "demon"],
    "durability": {
      "enabled": false,
      "max": 0
    },
    "cost": 25,
    "sellValue": 12,
    "description": "A leather-wrapped lead weight, perfect for knocking out unsuspecting foes.",
    "tags": ["melee", "bludgeoning", "stealth", "non-lethal"]
  },
  {
    "id": "blowgun",
    "name": "Blowgun",
    "type": "weapon",
    "category": "ranged",
    "rarity": "common",
    "damage": {
      "base": 4,
      "min": 2,
      "max": 6
    },
    "scaling": {
      "strength": 0.0,
      "agility": 0.8,
      "intelligence": 0.0
    },
    "combatModifiers": {
      "speed": 12,
      "critChance": 0.08,
      "blockPower": 0
    },
    "allowedClasses": ["rogue", "archer", "assassin"],
    "allowedRaces": ["human", "elf", "halfling", "gnome", "demon"],
    "durability": {
      "enabled": false,
      "max": 0
    },
    "cost": 20,
    "sellValue": 10,
    "description": "A hollow tube for firing needles or darts, often used with poisons.",
    "tags": ["ranged", "piercing", "stealth"]
  },
  {
    "id": "bone_staff",
    "name": "Bone Staff",
    "type": "weapon",
    "category": "staff",
    "rarity": "common",
    "damage": {
      "base": 8,
      "min": 6,
      "max": 10
    },
    "scaling": {
      "strength": 0.4,
      "agility": 0.2,
      "intelligence": 0.4
    },
    "combatModifiers": {
      "speed": 2,
      "critChance": 0.05,
      "blockPower": 5
    },
    "allowedClasses": ["mage", "cleric", "druid"],
    "allowedRaces": ["human", "elf", "dwarf", "orc", "halfling", "gnome", "demon"],
    "durability": {
      "enabled": false,
      "max": 0
    },
    "cost": 45,
    "sellValue": 22,
    "description": "A staff carved from hardened bone, infused with primal magic.",
    "tags": ["melee", "bludgeoning", "magical", "focus"]
  },
  {
    "id": "club",
    "name": "Club",
    "type": "weapon",
    "category": "bludgeon",
    "rarity": "common",
    "damage": {
      "base": 7,
      "min": 5,
      "max": 9
    },
    "scaling": {
      "strength": 0.6,
      "agility": 0.0,
      "intelligence": 0.0
    },
    "combatModifiers": {
      "speed": 0,
      "critChance": 0.03,
      "blockPower": 2
    },
    "allowedClasses": ["warrior", "druid", "rogue"],
    "allowedRaces": ["human", "elf", "dwarf", "orc", "halfling", "gnome", "demon"],
    "durability": {
      "enabled": false,
      "max": 0
    },
    "cost": 10,
    "sellValue": 5,
    "description": "A simple wooden club, crude but effective.",
    "tags": ["melee", "bludgeoning", "improvised", "starter"]
  },
  {
    "id": "crossbow_heavy",
    "name": "Crossbow (heavy)",
    "type": "weapon",
    "category": "crossbow",
    "rarity": "common",
    "damage": {
      "base": 16,
      "min": 12,
      "max": 20
    },
    "scaling": {
      "strength": 0.6,
      "agility": 0.2,
      "intelligence": 0.0
    },
    "combatModifiers": {
      "speed": -10,
      "critChance": 0.08,
      "blockPower": 0
    },
    "allowedClasses": ["warrior", "archer", "rogue"],
    "allowedRaces": ["human", "elf", "dwarf", "orc", "halfling", "gnome", "demon"],
    "durability": {
      "enabled": false,
      "max": 0
    },
    "cost": 150,
    "sellValue": 75,
    "description": "A massive crossbow that requires both hands and a crank to reload, but delivers devastating bolts.",
    "tags": ["ranged", "piercing", "heavy", "two-handed"]
  },
  {
    "id": "curved_dagger_ritual",
    "name": "Curved Dagger (ritual / demon)",
    "type": "weapon",
    "category": "dagger",
    "rarity": "uncommon",
    "damage": {
      "base": 8,
      "min": 6,
      "max": 10
    },
    "scaling": {
      "strength": 0.2,
      "agility": 0.5,
      "intelligence": 0.3
    },
    "combatModifiers": {
      "speed": 5,
      "critChance": 0.12,
      "blockPower": 1
    },
    "allowedClasses": ["rogue", "assassin", "necromancer", "mage"],
    "allowedRaces": ["human", "elf", "demon", "orc"],
    "durability": {
      "enabled": false,
      "max": 0
    },
    "cost": 120,
    "sellValue": 60,
    "description": "A sinister, wavy-bladed dagger used in forbidden rites.",
    "tags": ["melee", "piercing", "ritual", "magical"]
  },
  {
    "id": "dagger",
    "name": "Dagger",
    "type": "weapon",
    "category": "dagger",
    "rarity": "common",
    "damage": {
      "base": 6,
      "min": 4,
      "max": 8
    },
    "scaling": {
      "strength": 0.2,
      "agility": 0.7,
      "intelligence": 0.0
    },
    "combatModifiers": {
      "speed": 10,
      "critChance": 0.10,
      "blockPower": 1
    },
    "allowedClasses": ["warrior", "rogue", "assassin", "mage", "cleric"],
    "allowedRaces": ["human", "elf", "dwarf", "orc", "halfling", "gnome", "demon"],
    "durability": {
      "enabled": false,
      "max": 0
    },
    "cost": 25,
    "sellValue": 12,
    "description": "A small, versatile blade, easily concealed and quick to draw.",
    "tags": ["melee", "piercing", "light", "stealth"]
  },
  {
    "id": "dart",
    "name": "Dart",
    "type": "weapon",
    "category": "ranged",
    "rarity": "common",
    "damage": {
      "base": 4,
      "min": 2,
      "max": 6
    },
    "scaling": {
      "strength": 0.1,
      "agility": 0.8,
      "intelligence": 0.0
    },
    "combatModifiers": {
      "speed": 15,
      "critChance": 0.07,
      "blockPower": 0
    },
    "allowedClasses": ["rogue", "archer", "warrior"],
    "allowedRaces": ["human", "elf", "halfling", "gnome", "demon"],
    "durability": {
      "enabled": false,
      "max": 0
    },
    "cost": 5,
    "sellValue": 2,
    "description": "A lightweight throwing dart, easy to carry in quantity.",
    "tags": ["ranged", "piercing", "thrown", "consumable"]
  },
  {
    "id": "falchion",
    "name": "Falchion",
    "type": "weapon",
    "category": "sword",
    "rarity": "common",
    "damage": {
      "base": 11,
      "min": 8,
      "max": 14
    },
    "scaling": {
      "strength": 0.7,
      "agility": 0.3,
      "intelligence": 0.0
    },
    "combatModifiers": {
      "speed": -1,
      "critChance": 0.05,
      "blockPower": 3
    },
    "allowedClasses": ["warrior", "paladin", "archer"],
    "allowedRaces": ["human", "elf", "orc", "demon"],
    "durability": {
      "enabled": false,
      "max": 0
    },
    "cost": 90,
    "sellValue": 45,
    "description": "A curved, single-edged sword that excels at slashing.",
    "tags": ["melee", "slashing", "curved"]
  },
  {
    "id": "flail",
    "name": "Flail",
    "type": "weapon",
    "category": "flail",
    "rarity": "common",
    "damage": {
      "base": 12,
      "min": 9,
      "max": 15
    },
    "scaling": {
      "strength": 0.8,
      "agility": 0.1,
      "intelligence": 0.0
    },
    "combatModifiers": {
      "speed": -4,
      "critChance": 0.06,
      "blockPower": 2
    },
    "allowedClasses": ["warrior", "paladin", "cleric"],
    "allowedRaces": ["human", "elf", "dwarf", "orc", "demon"],
    "durability": {
      "enabled": false,
      "max": 0
    },
    "cost": 110,
    "sellValue": 55,
    "description": "A handle attached to a spiked ball by a chain, capable of striking around shields.",
    "tags": ["melee", "bludgeoning", "chain", "flail"]
  },
  {
    "id": "flamberge_zweihander",
    "name": "Flamberge (zweihänder)",
    "type": "weapon",
    "category": "greatsword",
    "rarity": "rare",
    "damage": {
      "base": 18,
      "min": 14,
      "max": 22
    },
    "scaling": {
      "strength": 0.9,
      "agility": 0.1,
      "intelligence": 0.0
    },
    "combatModifiers": {
      "speed": -8,
      "critChance": 0.07,
      "blockPower": 6
    },
    "allowedClasses": ["warrior", "paladin"],
    "allowedRaces": ["human", "elf", "orc", "dwarf"],
    "durability": {
      "enabled": false,
      "max": 0
    },
    "cost": 250,
    "sellValue": 125,
    "description": "A massive two-handed sword with a wavy blade, designed to break spear shafts and intimidate.",